{
  "schema_version": "dsh-task-cleaner/manifest/v1alpha1",
  "manifest_id": "11111111-1111-4111-8111-111111111111",
  "task_id": "task-001",
  "run_id": "run-001",
  "dsh_version": "0.1.2-rc.1",
  "plugin_version": "0.1.0",
  "scope": {
    "workspace_root_rel": ".",
    "root_anchor": "aaaaaaaaaaaaaaaaaaaaaaaaaaaaaaaaaaaaaaaaaaaaaaaaaaaaaaaaaaaaaaaa",
    "boundary_policy_ref": "policy:baseline"
  },
  "created_at": "2026-09-09T00:00:00Z",
  "status": "draft",
  "artifacts": [
    {
      "artifact_id": "22222222-2222-4222-8222-222222222222",
      "candidate_id": "cand-001",
      "decision_id": "decision-001",
      "rel_path": "out/gen/tmp-123.txt",
      "source_real_path": "/workspace/out/gen/tmp-123.txt",
      "kind": "temp",
      "provenance": "task_write",
      "identity": {
        "dev": "1",
        "ino": "2",
        "nlink": 1,
        "ctime": "2026-09-09T00:00:00Z"
      },
      "size_bytes": 12,
      "sha256": "bbbbbbbbbbbbbbbbbbbbbbbbbbbbbbbbbbbbbbbbbbbbbbbbbbbbbbbbbbbbbbbb",
      "mtime": "2026-09-09T00:00:00Z",
      "mode": "0644",
      "git_tracked": false,
      "symlink": null,
      "matched_by": ["rule:temp-ext"],
      "state": "candidate"
    }
  ]
}
